REVIEW_ID,RESTAURANT_ID,CUSTOMER_ID,RATING,REVIEW_DATE,ORDER_TYPE,REVIEW_TEXT,RESTAURANT_NAME,RESTAURANT_CUISINE_TYPE,PRICE_RANGE,RESTAURANT_LOCATION_AREA,RESTAURANT_LOCATION_NEIGHBORHOOD,RESTAURANT_LOCATION_REGION,RESTAURANT_OPENING_HOURS,RESTAURANT_HAS_DELIVERY,RESTAURANT_HAS_TAKEOUT,RESTAURANT_DATE_ADDED,CUSTOMER_NAME,CUSTOMER_EMAIL,CUSTOMER_JOIN_DATE,CUSTOMER_PREFERRED_CUISINE,CUSTOMER_CITY,CUSTOMER_STATE,IS_CUSTOMER_FREQUENT
95,445,7750,3.5,2023-07-04 00:10:51.000,takeout,"I stopped by Lane Ltd Tokyo for a takeout dinner and had a decent, if unremarkable, experience. The sushi and sashimi I ordered were fresh and well-prepared, but lacked a certain wow factor that would have elevated them to the next level. The spicy tuna roll was a highlight, with a nice balance of flavors and textures, but the accompanying miso soup was overly salty. Overall, Lane Ltd Tokyo is a solid choice for a quick and reliable Japanese meal, but it didn't particularly stand out from the crowd.",Lane Ltd Tokyo,Japanese,$,Uptown,Upper East Side,North,10AM - 9PM,true,true,2024-02-13,Ashley Callahan,anna02@example.com,2022-12-08,Mexican,Toddhaven,MI,false
96,540,9469,3.5,2024-09-08 00:10:51.000,takeout,"I stopped by Smith PLC Tokyo for a takeout order and had a decent, if unremarkable, experience. The tonkatsu bento box I ordered was cooked to a nice crisp, but the portion size was a bit smaller than I'd expected for the price. The accompanying miso soup and pickled vegetables were pleasant, but nothing out of the ordinary. Overall, Smith PLC Tokyo is a solid choice for a quick Japanese fix, but it didn't particularly stand out from the crowd.",Smith PLC Tokyo,Japanese,$$$,Midtown,Chelsea,Central,9AM - 8PM,false,true,2024-04-07,Debbie Brooks,cynthia24@example.com,2022-05-09,Chinese,Ashleyshire,VT,false
97,404,2284,4.0,2024-02-08 00:10:51.000,dine-in,"""I'm so glad I stumbled upon Lutz-Williams Saigon - this hidden gem is a must-visit for any Vietnamese food lover! The pho was rich and flavorful, with tender beef and a generous serving of fresh herbs, and the banh mi was crispy and perfectly balanced. The service was friendly and attentive, if a bit slow at times, but the cozy atmosphere and delicious food more than made up for it. Overall, I'd highly recommend Lutz-Williams Saigon for a satisfying and authentic Vietnamese meal - just be prepared for a wait, especially on weekends."" 4/5 stars",Lutz-Williams Saigon,Vietnamese,$$$$,Uptown,Upper East Side,North,10AM - 11PM,true,true,2024-07-31,Jessica Navarro,chenmeghan@example.org,2023-11-15,Chinese,Lake James,ID,false
98,907,8829,1.5,2024-12-19 00:10:51.000,delivery,"I was thoroughly underwhelmed by my recent delivery experience from Thomas-Johnson, a Thai restaurant that promised much but delivered little. The pad thai I ordered was a soggy, flavorless mess, with overcooked noodles and a cloying sweetness that dominated the dish. The ""spicy"" tom yum soup was similarly disappointing, with a heat level that was more akin to a gentle simmer than a fiery blaze. For the prices they're charging, I expect a lot more than the bland, uninspired fare that Thomas-Johnson is serving up.",Thomas-Johnson,Thai,$$$$,West Side,Riverside,West,11AM - 12PM,false,true,2024-01-01,Gerald Lopez,jennifer27@example.net,2024-11-25,American,South Theresaview,MI,false
99,626,4049,4.5,2024-04-04 00:10:51.000,dine-in,"""I recently celebrated my anniversary at Newton, Graham and Andrade, and I must say, it was an unforgettable experience. The moment we walked in, we were greeted with warm smiles and a cozy ambiance that set the tone for a wonderful evening. The service was top-notch, with our server expertly guiding us through the menu and making spot-on recommendations. The food was truly exceptional, with the Kung Pao chicken and pan-seared dumplings standing out as highlights - the flavors were bold, the presentation was beautiful, and the portions were generous. Overall, I'd give Newton, Graham and Andrade 4.5 stars - it's a must-visit for any Chinese food lover, and a great choice for special occasions.""","Newton, Graham and Andrade",Chinese,$$,Suburb,Pine Hills,Outer,8AM - 9PM,true,true,2024-12-14,Carlos Reilly,hweeks@example.net,2023-05-29,Mediterranean,West Kristin,WI,true
100,594,8213,5.0,2024-11-20 00:10:51.000,dine-in,"""I'm still reeling from my exceptional dining experience at Ward, Singh and Mullins, a true gem in the world of Japanese cuisine. As a pescatarian with a gluten intolerance, I was thrilled to find a separate gluten-free menu that didn't sacrifice an ounce of flavor. The chef's selection of sashimi-grade tuna and scallops was sublime, and the vegan 'dragon roll' was a game-changer - who knew tofu could be so decadent? The service was attentive and knowledgeable, with our server happily guiding us through the menu's many options. Overall, a flawless 5-star experience that has left me eager to return.""","Ward, Singh and Mullins",Japanese,$,Suburb,Pine Hills,Outer,7AM - 11PM,true,true,2024-08-14,Walter Clements,ksmith@example.net,2024-05-13,Italian,Mccoyside,SD,true
