REVIEW_ID,RESTAURANT_ID,CUSTOMER_ID,RATING,REVIEW_DATE,ORDER_TYPE,REVIEW_TEXT,RESTAURANT_NAME,RESTAURANT_CUISINE_TYPE,PRICE_RANGE,RESTAURANT_LOCATION_AREA,RESTAURANT_LOCATION_NEIGHBORHOOD,RESTAURANT_LOCATION_REGION,RESTAURANT_OPENING_HOURS,RESTAURANT_HAS_DELIVERY,RESTAURANT_HAS_TAKEOUT,RESTAURANT_DATE_ADDED,CUSTOMER_NAME,CUSTOMER_EMAIL,CUSTOMER_JOIN_DATE,CUSTOMER_PREFERRED_CUISINE,CUSTOMER_CITY,CUSTOMER_STATE,IS_CUSTOMER_FREQUENT
1,437,2276,4.5,2024-08-26 00:10:51.000,delivery,"""I'm so glad I discovered Larson and Sons Aegean, a hidden gem that delivers (literally!) on its promise of authentic Mediterranean cuisine. As a vegetarian, I was thrilled to see a variety of options on the menu, and the Grilled Portobello Mushroom Shawarma Wrap I ordered did not disappoint - the flavors were rich and well-balanced, and the pita was soft and fresh. The accompanying side of roasted vegetables was also a highlight, with a delightful drizzle of lemon-tahini sauce. My only quibble is that the falafel, while crispy on the outside, was slightly overcooked on the inside - but overall, I'm excited to order from Larson and Sons again and explore more of their menu. 4.5/5 stars!""",Larson and Sons Aegean,Mediterranean,$$$,Midtown,Garment District,Central,8AM - 11PM,true,true,2024-07-19,Laura Williams,weaverdonald@example.org,2023-12-30,Italian,Port Patriciahaven,MO,true
2,464,3684,4.0,2025-01-13 00:10:51.000,delivery,"""I was thoroughly impressed with my delivery order from Wagner-Howard Curry - the flavors were rich and bold, and the portion sizes were generous to say the least. The Chicken Tikka Masala was a standout, with tender, juicy chicken in a creamy, slightly smoky sauce that I couldn't get enough of. The basmati rice and naan bread were also cooked to perfection. My only quibble was that the delivery took a bit longer than expected, but the food was well worth the wait - I'd definitely order from Wagner-Howard Curry again. 4/5 stars!""",Wagner-Howard Curry,Indian,$$$,University Area,College Town,North,11AM - 10PM,true,true,2023-08-21,Harold Howard,jameswillis@example.net,2023-01-14,Japanese,Ruizhaven,CO,true
3,749,735,4.0,2025-01-07 00:10:51.000,dine-in,"**4.0/5 stars**

I stopped by Moreno-Phillips Italiano to celebrate my sister's birthday with a family dinner, and while it was a solid choice, it didn't entirely blow us away. The atmosphere was cozy and intimate, with dim lighting and traditional Italian decor, which set the tone for a nice evening out. The pasta dishes we ordered, including the spaghetti Bolognese and fettuccine Alfredo, were cooked al dente and flavorful, but the portions were a tad small for the price point. Overall, it was a pleasant dining experience, but not particularly memorable or outstanding in any way.",Moreno-Phillips Italiano,Italian,$,Uptown,Upper East Side,North,8AM - 8PM,true,true,2023-10-13,Katherine James,williamskerry@example.com,2025-01-24,Various,Oconnorborough,RI,false
4,42,4777,4.0,2025-01-19 00:10:51.000,dine-in,"""I recently had the pleasure of dining at Dominguez-Lee Trattoria, and I must say, it's a hidden gem in the neighborhood. The pasta dishes are clearly made with love and care, as evidenced by the perfectly cooked spaghetti carbonara I devoured. The service was attentive and knowledgeable, with our server happily guiding us through the menu and making excellent wine pairing recommendations. While the atmosphere could benefit from a bit more ambiance, the food and service more than made up for it - I'd highly recommend a visit to this charming trattoria. Overall, a solid 4-star experience that I'd be happy to repeat.""",Dominguez-Lee Trattoria,Italian,$$$,Downtown,Financial District,Central,10AM - 12PM,true,true,2023-04-01,Lauren Williams,edwardhodge@example.org,2023-08-11,Mexican,Gilesshire,MO,false
5,256,9179,4.5,2024-10-25 00:10:51.000,takeout,"""I'm so glad I stumbled upon Landry, Joseph and Jones - their takeout game is on point! I ordered the grilled chicken sandwich and sweet potato fries, and both were expertly prepared and packed with care. The chicken was juicy and flavorful, with a nice char on the outside, and the fries were crispy and addictive. My only minor quibble was that the sandwich could have used a bit more sauce, but overall, I was thoroughly impressed with the quality and value of my meal. Definitely recommend for a satisfying and convenient dinner on-the-go!"" 4.5/5 stars","Landry, Joseph and Jones",American,$,Suburb,Oakwood,Outer,8AM - 8PM,true,true,2024-04-07,Jessica Wagner,clarkebrian@example.com,2022-05-02,French,Lake Lisa,AL,false
6,922,3976,2.0,2024-04-23 00:10:51.000,dine-in,"**2/5 stars**

I'm usually not one to write scathing reviews, but my recent dinner experience at Macdonald, Ashley and Murphy Italiano was a letdown. The pasta dishes, which I was looking forward to, were overcooked and lacked any real depth of flavor - my spaghetti Bolognese was particularly disappointing, with a sauce that tasted more like ketchup than rich, slow-cooked ragù. The service was friendly, but our server seemed overwhelmed, taking ages to refill drinks and forgetting one of our appetizers altogether. For the prices they're charging, I expect a lot more from an Italian restaurant.","Macdonald, Ashley and Murphy Italiano",Italian,$$,Suburb,Oakwood,Outer,8AM - 11PM,true,true,2024-03-16,Lauren King,michaeljennings@example.org,2022-07-29,Various,Martinezton,OH,true
7,305,2988,1.5,2024-06-10 00:10:51.000,takeout,"**Disappointing Takeout Experience at Howard-Martin Diner**

I'm still trying to process the subpar takeout experience I had from Howard-Martin Diner, especially since it was my wife's birthday and I was hoping to make it a special night. Unfortunately, the food fell flat - the "" signature"" burger was overcooked and dry, and the fries were lukewarm and soggy. The ""birthday special"" dessert we ordered, a supposedly decadent chocolate cake, was a bland, store-bought affair that lacked any real flavor or presentation. For a diner that's been around for years, I expected a lot more attention to detail and care in their takeout orders. Needless to say, we won't be back.",Howard-Martin Diner,American,$$$$,Midtown,Garment District,Central,11AM - 9PM,true,true,2024-02-08,Krystal Joyce,acasey@example.org,2024-04-14,Italian,Lake Jenniferside,NJ,true
8,624,2752,3.0,2024-02-18 00:10:51.000,takeout,"**3.0/5 stars**

I ordered takeout from Ward Inc to celebrate my friend's birthday, and while it was a decent choice, it didn't particularly wow us. As a vegetarian, I was excited to try their vegan ""chick'n"" satay, which was flavorful but a bit overcooked. The pad thai was a highlight, with a good balance of sweet and sour flavors, but the portion size was smaller than expected. Overall, Ward Inc is a solid option for a quick and easy Thai fix, but it's not a standout in the city's culinary scene.",Ward Inc,Thai,$$$,Uptown,Upper East Side,North,7AM - 10PM,true,false,2024-12-24,Barbara Holloway,castillomichael@example.net,2022-08-22,Thai,Belindafurt,MA,true
9,36,8549,4.0,2025-01-11 00:10:51.000,delivery,"**4.0/5 stars**

I ordered from Noble PLC for my wife's birthday dinner, opting for their delivery service to make the evening a bit more special. While the food was certainly delicious, I couldn't help but feel that it didn't quite live up to the high expectations I had for a French restaurant of this caliber. The duck confit was tender and flavorful, but the accompanying vegetables were slightly overcooked, and the bouillabaisse, while rich and satisfying, lacked a bit of depth. Overall, it was a solid, if not spectacular, dining experience, and I would consider ordering from Noble PLC again, but perhaps with slightly tempered expectations.",Noble PLC,French,$$$$,Midtown,Chelsea,Central,11AM - 8PM,false,true,2024-12-03,Michael Frank,emilyfields@example.org,2024-07-16,Indian,Lake Pamelaburgh,WA,false
10,265,8592,4.0,2024-11-12 00:10:51.000,delivery,"**4.0/5 stars**

I recently tried Camacho-Hill's delivery service, and while it was a solid experience, it didn't quite blow me away. The French onion soup was rich and flavorful, and the duck confit was cooked to perfection, but the accompanying roasted vegetables were slightly overcooked. The service was prompt and friendly, with a courteous delivery person who called to confirm the order and estimated arrival time. Overall, Camacho-Hill's food is well-executed, but it didn't particularly stand out from other French restaurants I've tried in the area.",Camacho-Hill,French,$$,Business District,Tech Corridor,Central,11AM - 8PM,true,true,2024-06-26,David Allen,lorimorris@example.net,2022-05-21,Various,Lake Robertbury,AL,false
11,682,8815,5.0,2024-12-11 00:10:51.000,delivery,"""I'm still reeling from the exceptional dining experience I had with Lara-Phillips' delivery service - the epitome of French cuisine in the comfort of my own home! The Bouillabaisse was a masterclass in rich, velvety broth and tender seafood, while the Duck Confit was fall-off-the-bone tender with a crispy, caramelized skin that added a delightful textural element. The accompanying sides, including the garlic mashed potatoes and sautéed spinach, were cooked to perfection and complemented the main courses beautifully. Overall, Lara-Phillips has set a new standard for delivery cuisine in my book - 5 stars isn't enough, I'd give it 10 if I could!""",Lara-Phillips,French,$$$,Suburb,Pine Hills,Outer,9AM - 8PM,true,true,2025-01-17,Meagan James,carla42@example.net,2023-04-28,Indian,East Douglas,DE,false
12,541,1915,4.0,2023-09-11 00:10:51.000,delivery,"""I was thoroughly impressed with my delivery order from Bishop PLC - the flavors and quality of the dishes were on par with some of the best Chinese restaurants I've had the pleasure of dining at. The Kung Pao chicken was spicy and savory, with a generous portion of crunchy peanuts and scallions, while the vegetable lo mein was cooked to a perfect tender-crisp texture. My only minor quibble was that the delivery took a bit longer than expected, but the food was still hot and fresh when it arrived. Overall, I'd highly recommend Bishop PLC for a satisfying and authentic Chinese food fix - I'll definitely be ordering from them again!"" 4/5 stars",Bishop PLC,Chinese,$$$$,East Side,Harbor Heights,East,11AM - 10PM,true,true,2024-02-05,Samantha Alexander,cathy10@example.com,2024-09-14,American,South Robert,WV,false
13,141,3953,2.0,2024-12-18 00:10:51.000,dine-in,"**2/5 stars**

I'm usually not one to write scathing reviews, but my recent dinner experience at Ramirez, Bell and Simpson Dragon was a major letdown. The Kung Pao chicken was overcooked and dry, with a sauce that tasted more like ketchup than Szechuan pepper. The service was also inattentive, with our server seemingly more interested in chatting with the kitchen staff than refilling our drinks. For a restaurant with such a bold name, the flavors and service were disappointingly bland.","Ramirez, Bell and Simpson Dragon",Chinese,$$$,Downtown,Financial District,Central,11AM - 12PM,true,true,2023-06-22,Christopher Gonzalez,jamesfranco@example.net,2024-04-11,American,Lake Matthewmouth,GA,false
14,998,7691,3.0,2023-04-21 00:10:51.000,takeout,"I stopped by Wilson Inc to try their Mediterranean takeout, and while it was a solid option, it didn't particularly stand out from the crowd. The falafel wrap I ordered was crispy and flavorful, but the accompanying hummus and tabbouleh were just average. The portion size was generous, but the overall presentation was lacking, with everything tossed into a cardboard container without much care. For the price, I expected a bit more attention to detail, but it was still a satisfying, if unremarkable, meal.",Wilson Inc,Mediterranean,$,Downtown,Financial District,Central,9AM - 10PM,false,true,2023-05-08,Mr. Kevin Lucero DVM,opeterson@example.com,2024-08-26,French,West Donnahaven,SC,false
15,876,554,4.0,2025-01-28 00:10:51.000,dine-in,"**4.0/5 stars**

I stopped by Sanders, Bowen and Hardy Olive for a Mediterranean-inspired dinner and was generally pleased with my experience. As a pescatarian, I appreciated the variety of seafood options on the menu, and the grilled octopus appetizer was a highlight - tender and flavorful with a nice char. However, the vegetarian moussaka, while rich and satisfying, was slightly overpriced at $22. The service was friendly and attentive, but not overly knowledgeable about the menu's gluten-free options, which might be a concern for diners with dietary restrictions. Overall, a solid choice for Mediterranean cuisine, but not particularly memorable.","Sanders, Bowen and Hardy Olive",Mediterranean,$$,Suburb,Pine Hills,Outer,10AM - 10PM,true,true,2024-01-28,David Cannon,xjoseph@example.com,2024-05-09,Vietnamese,Danielstad,PW,true
16,857,5073,3.5,2024-11-07 00:10:51.000,takeout,"""I was pleasantly surprised by the flavors and value offered by Alvarado LLC Palace, a hidden gem for Chinese takeout in the area. The Kung Pao chicken was a highlight, with a perfect balance of spicy and savory notes, and the portion size was generous to say the least. While the egg rolls were a tad greasy, the overall quality of the food and speedy delivery (under 30 minutes!) made up for it. For a quick and satisfying meal, Alvarado LLC Palace is definitely worth a try - just be prepared for some minor inconsistencies in the cooking. Overall, a solid 3.5 stars from this reviewer!""",Alvarado LLC Palace,Chinese,$$$$,East Side,Harbor Heights,East,11AM - 11PM,true,false,2023-08-02,Jessica Jenkins,keith81@example.net,2024-12-06,Japanese,New Lisamouth,IA,false
17,753,3402,5.0,2024-10-05 00:10:51.000,takeout,"""I'm blown away by the incredible flavors and generous portions from Lewis, Garcia and Myers! I ordered takeout from this hidden gem and was thoroughly impressed by the tender carnitas, rich mole, and creamy guacamole that arrived at my doorstep. The attention to detail in every dish was evident, from the crispy tortilla chips to the fresh cilantro sprinkled on top of my tacos. For a takeout experience that rivals a sit-down meal, look no further than Lewis, Garcia and Myers - 5 stars isn't enough, I'd give it 10 if I could!""","Lewis, Garcia and Myers",Mexican,$$$,Midtown,Garment District,Central,11AM - 12PM,true,true,2023-08-19,Douglas Whitehead,benjaminwilson@example.org,2024-12-30,American,Lyonsstad,NY,false
18,243,8432,5.0,2024-10-06 00:10:51.000,dine-in,"""I'm still reeling from the incredible dining experience I had at Mendoza, Valencia and Johnson last night. From the moment we walked in, the warm and inviting atmosphere set the tone for a truly exceptional evening. The pasta dishes we ordered, including the handmade pappardelle and the decadent truffle risotto, were cooked to perfection and bursting with rich, authentic Italian flavors. The service was top-notch, with our server expertly guiding us through the menu and wine list. Overall, I'd highly recommend Mendoza, Valencia and Johnson to anyone seeking a truly unforgettable Italian meal - 5 stars, without a doubt!""","Mendoza, Valencia and Johnson",Italian,$$,Midtown,Chelsea,Central,8AM - 12PM,true,true,2023-08-31,Stephanie Miller,christopherbonilla@example.org,2024-06-08,Vietnamese,South Michael,SC,true
19,566,7299,5.0,2023-07-24 00:10:51.000,dine-in,"""I'm still reeling from my exceptional dining experience at Mcgee, Hansen and Miller Mediterranean! The moment I walked in, I was enveloped in the warm and inviting atmosphere, complete with rustic decor and the enticing aroma of freshly baked pita bread. The service was top-notch, with our server expertly guiding us through the menu and making spot-on recommendations. The real star of the show, however, was the food - the grilled octopus was tender and smoky, and the lamb gyro was a masterclass in flavor and texture. Overall, a truly unforgettable meal that has earned Mcgee, Hansen and Miller a well-deserved 5-star rating from this reviewer!""","Mcgee, Hansen and Miller Mediterranean",Mediterranean,$$$,West Side,Harborview,West,8AM - 11PM,true,true,2024-09-14,Brittney Jacobson,kcooper@example.com,2022-03-14,Italian,Martinview,ME,false
20,50,795,4.5,2023-09-14 00:10:51.000,takeout,"""I'm so glad I stumbled upon Mcintosh Group for my Thai food fix - their takeout game is on point! I ordered the Pad Thai and Green Curry, and both dishes were expertly prepared with bold, balanced flavors that transported me straight to the streets of Bangkok. The portion sizes were generous, to say the least, and the prices were very reasonable. My only minor quibble was that the rice was slightly overcooked, but it didn't detract from the overall experience - I'd highly recommend Mcintosh Group to anyone craving authentic Thai cuisine. 4.5/5 stars, can't wait to order again!""",Mcintosh Group,Thai,$$$,Midtown,Garment District,Central,7AM - 8PM,false,true,2024-08-09,Cynthia Brown,patrickchurch@example.org,2022-08-12,Mediterranean,West Theresamouth,SD,false
21,73,3472,5.0,2024-09-18 00:10:51.000,dine-in,"""I'm still reeling from my incredible dining experience at Mckenzie Group Diner! The moment I walked in, I was greeted with a warm smile and a cozy atmosphere that set the tone for a fantastic meal. The service was top-notch, with our server being attentive and knowledgeable about the menu. But the real star of the show was the food - I opted for the signature burger and it was cooked to perfection, with a juicy patty, crispy bacon, and all the fixings. Overall, I'm so impressed with Mckenzie Group Diner and can't wait to come back and try more of their delicious American classics!"" 5/5 stars",Mckenzie Group Diner,American,$$,University Area,College Town,North,8AM - 8PM,true,true,2023-08-06,Lisa Russo,parkscolleen@example.org,2022-06-07,American,New Philipborough,MN,false
22,137,2169,3.0,2024-01-14 00:10:51.000,takeout,"**3.0/5 stars**

I stopped by Banks, Cruz and Mcconnell Tokyo for a quick takeout dinner, hoping to satisfy my cravings for some authentic Japanese flavors. As a pescatarian, I was pleased to see a variety of seafood options on the menu, but unfortunately, the dishes I ordered didn't quite live up to my expectations. The spicy tuna roll was fresh and flavorful, but the ""veggie tempura"" I added as a side was a bit greasy and lacking in variety (just carrots and zucchini). Overall, it was a decent, if unremarkable, meal that I wouldn't go out of my way for, but might consider again if I'm in the area and craving Japanese takeout.","Banks, Cruz and Mcconnell Tokyo",Japanese,$$,Downtown,Financial District,Central,10AM - 8PM,true,true,2024-12-18,Alexander Garcia,nicolecarter@example.com,2022-04-01,Japanese,Dixonbury,ME,true
23,358,5881,3.0,2024-09-16 00:10:51.000,takeout,"**3.0/5 stars**

I stopped by Robinson Inc Thai Spice for a quick takeout dinner and had a decent, if unremarkable, experience. As a vegetarian, I was pleased to see a variety of options on the menu, including a vegan ""chicken"" satay that was surprisingly convincing. However, the pad thai I ordered was a bit too sweet for my taste, and the portion size was smaller than I expected for the price. Overall, Robinson Inc Thai Spice is a solid choice for a quick, convenient meal, but it didn't particularly stand out from other Thai places I've tried.",Robinson Inc Thai Spice,Thai,$$$$,Downtown,Theater District,Central,10AM - 9PM,false,false,2023-06-26,Judith Wilson,tamaraowen@example.org,2023-10-06,Mexican,Port Melissa,MN,false
24,301,2702,4.0,2024-10-13 00:10:51.000,takeout,"""I was thoroughly impressed with my takeout experience from Moore Inc, a hidden gem of an Italian restaurant in the area. The pasta dishes I ordered, including the spaghetti Bolognese and fettuccine Alfredo, were cooked to perfection and packed with rich, bold flavors. The portions were generous and the prices were very reasonable, especially considering the high quality of the ingredients. My only minor quibble was that the garlic bread could have been crisper, but overall, I'd highly recommend Moore Inc for a satisfying and authentic Italian meal - 4/5 stars!""",Moore Inc,Italian,$,Uptown,Upper West Side,North,8AM - 9PM,true,true,2023-08-30,Frederick Willis,akelly@example.net,2023-09-11,Mediterranean,New Christopherville,VI,false
25,628,1032,1.5,2024-11-16 00:10:51.000,takeout,"I was thoroughly underwhelmed by my takeout experience from Rose PLC, a local Indian eatery that failed to deliver on its promises. The chicken tikka masala, a dish I've had countless times at other restaurants, was a lackluster affair - the chicken was overcooked and dry, and the sauce lacked the rich, creamy flavor I've come to expect. The basmati rice was also a letdown, with a strange, almost metallic aftertaste that lingered unpleasantly. For the prices they're charging, I expect a lot more flavor and care in the preparation - unfortunately, Rose PLC fell far short.",Rose PLC,Indian,$$,West Side,Harborview,West,7AM - 8PM,true,true,2024-07-12,Rachel Lynn,ugarcia@example.net,2024-12-26,Japanese,Ryanmouth,TN,true
26,802,8084,4.5,2025-01-01 00:10:51.000,delivery,"""I recently ordered delivery from Clark-Hill Pasta to celebrate my sister's birthday, and I'm so glad I did! The pasta dishes we chose, including the Spaghetti Bolognese and Fettuccine Alfredo, were cooked to perfection and arrived hot and fresh at our doorstep. The portions were generous, and the flavors were rich and authentic - it truly felt like a taste of Italy in the comfort of our own home. The only reason I'm not giving it a full 5 stars is that the garlic bread was a bit overcooked, but overall, Clark-Hill Pasta exceeded our expectations and made for a wonderful birthday celebration. Highly recommend!"" 4.5/5 stars",Clark-Hill Pasta,Italian,$,Suburb,Oakwood,Outer,11AM - 10PM,false,true,2023-08-30,Joan Lopez,michaelfuentes@example.com,2022-09-10,Various,Campbellland,MT,false
27,505,5146,3.0,2025-01-31 00:10:51.000,takeout,"I stopped by Mathis Group Pizza for a quick takeout dinner and left with mixed feelings. The crust on my margherita pizza was cooked to a perfect crisp, but the sauce and cheese could have used a bit more flavor and depth. The portion size was generous, but the overall experience felt somewhat unremarkable - not bad, but not particularly memorable either. For a casual, no-frills pizza night, Mathis Group Pizza gets the job done, but it's not a spot I'd go out of my way for.",Mathis Group Pizza,Italian,$$,West Side,Harborview,West,7AM - 12PM,false,true,2024-03-29,Derrick Baker,mary86@example.org,2023-04-27,Various,Port Kimberlyborough,KS,false
28,567,8775,4.0,2023-07-16 00:10:51.000,takeout,"""I'm so glad I stumbled upon Pacheco, Barry and Howard Curry - their takeout game is on point! I ordered the chicken tikka masala and saag paneer, and both dishes were rich and flavorful, with tender meat and perfectly cooked vegetables. The basmati rice and naan bread were also cooked to perfection, and the portion sizes were generous to say the least. My only minor quibble is that the spice levels could have been a bit more nuanced, but overall I was thoroughly impressed with the quality and value of my meal - 4 stars and I'll definitely be back!""","Pacheco, Barry and Howard Curry",Indian,$,Midtown,Garment District,Central,8AM - 8PM,true,true,2024-08-10,Mary Snyder,tonyfrey@example.org,2023-01-26,Mediterranean,Cervantesfurt,AK,true
29,65,1843,3.5,2024-02-21 00:10:51.000,takeout,"""I was pleasantly surprised by the takeout experience at Garcia, Serrano and Mejia Bistro, a French bistro that's clearly passionate about its craft. The Coq au Vin, which I ordered to go, was rich and flavorful, with tender chicken and a velvety sauce that held up surprisingly well to the commute home. While the accompanying pommes frites were a tad soggy, the overall quality of the dish made up for it. For a takeout meal, the presentation was also impressive, with each component carefully packaged and garnished. Overall, a solid 3.5 stars - I'd definitely order from Garcia, Serrano and Mejia again, and I'm curious to try their dine-in experience.""","Garcia, Serrano and Mejia Bistro",French,$,Suburb,Pine Hills,Outer,9AM - 8PM,true,true,2024-06-29,Thomas Hughes,acastaneda@example.org,2022-06-28,Japanese,West Wendymouth,DC,true
30,798,1461,5.0,2024-09-13 00:10:51.000,delivery,"""I'm blown away by the exceptional experience I had with Carter, Weaver and Richardson Grill's delivery service! As a vegetarian, I was thrilled to see a separate menu section dedicated to plant-based options, and the vegan 'black bean and sweet potato burger' I ordered did not disappoint - the flavors were rich and bold, and the patty was cooked to perfection. The gluten-free bun was a nice touch, and the side of roasted vegetables was cooked just right. The entire meal arrived hot and fresh, and the packaging was eco-friendly to boot. Five stars isn't enough - I'd give them ten if I could!""","Carter, Weaver and Richardson Grill",American,$$$$,Suburb,Pine Hills,Outer,8AM - 10PM,true,true,2023-04-23,Lindsey Woods,vjarvis@example.org,2024-01-11,American,South Natalietown,NM,false
31,752,9249,3.5,2024-03-22 00:10:51.000,takeout,"**3.5/5 stars**

I ordered takeout from Hernandez, White and Ferguson Aegean for my sister's birthday dinner, hoping to bring a taste of the Mediterranean to our celebration. While the food was solid, it didn't quite blow us away. The grilled octopus was tender and flavorful, but the spanakopita was a bit soggy and lacking in seasoning. The portions were generous, but the overall experience felt more like a casual weeknight dinner than a special occasion meal. Still, for the price and convenience, it was a decent choice, and we appreciated the friendly service.","Hernandez, White and Ferguson Aegean",Mediterranean,$,Business District,Tech Corridor,Central,10AM - 8PM,true,true,2023-11-14,Carolyn Riley,ashleejohnson@example.org,2025-01-28,Chinese,South Tommy,NY,false
