REVIEW_ID,RESTAURANT_ID,CUSTOMER_ID,RATING,REVIEW_DATE,ORDER_TYPE,REVIEW_TEXT,RESTAURANT_NAME,RESTAURANT_CUISINE_TYPE,PRICE_RANGE,RESTAURANT_LOCATION_AREA,RESTAURANT_LOCATION_NEIGHBORHOOD,RESTAURANT_LOCATION_REGION,RESTAURANT_OPENING_HOURS,RESTAURANT_HAS_DELIVERY,RESTAURANT_HAS_TAKEOUT,RESTAURANT_DATE_ADDED,CUSTOMER_NAME,CUSTOMER_EMAIL,CUSTOMER_JOIN_DATE,CUSTOMER_PREFERRED_CUISINE,CUSTOMER_CITY,CUSTOMER_STATE,IS_CUSTOMER_FREQUENT
32,642,4949,5.0,2024-07-06 00:10:51.000,delivery,"""I'm still grinning from ear to ear after celebrating my wife's birthday with a delivery order from Zimmerman-Douglas Diner. The food arrived promptly and was still piping hot, which is no easy feat considering we live 20 minutes away. The 'Classic Cheeseburger' and 'Creamy Tomato Soup' were absolute showstoppers - the burger patty was cooked to perfection and the soup was rich and velvety. The real icing on the cake was the complimentary birthday dessert, a decadent chocolate cake that was moist and indulgent. Five stars isn't enough - I'd give them ten if I could!""",Zimmerman-Douglas Diner,American,$$,Uptown,Upper West Side,North,7AM - 11PM,true,true,2023-06-17,Paige Houston,myersmark@example.com,2023-02-06,American,East Kirkmouth,FL,false
33,763,5915,2.0,2025-01-31 00:10:51.000,takeout,"**2/5 stars**

I was really looking forward to trying Ryan Group Curry, but unfortunately, my takeout experience was a letdown. The chicken tikka masala, which I was expecting to be a highlight, was overcooked and dry, with a sauce that tasted more like ketchup than rich, creamy tomato sauce. The basmati rice was also underseasoned and lacked the fluffy texture I've come to expect from a good Indian restaurant. For the prices they're charging, I expected a lot more flavor and care in the preparation of their dishes.",Ryan Group Curry,Indian,$$$,East Side,Eastwood,East,9AM - 8PM,true,true,2023-04-22,Jennifer Barrett,lisa57@example.com,2023-06-18,Various,Port John,VA,false
34,434,5323,4.0,2025-01-03 00:10:51.000,dine-in,"**4.0/5 stars**

I stopped by Powell Inc Mexicana for dinner last night and was thoroughly impressed with the vibrant atmosphere and delicious eats. As a vegetarian, I was pleased to see a variety of options on the menu, including a flavorful veggie fajita dish that was cooked to perfection. The service was friendly and attentive, and our server was happy to accommodate my gluten-free request by substituting the traditional tortillas with corn tortillas. While the prices were a tad higher than I expected, the generous portion sizes and high-quality ingredients made it well worth the splurge. Overall, I'd highly recommend Powell Inc Mexicana to anyone craving authentic Mexican cuisine with a modern twist.",Powell Inc Mexicana,Mexican,$,Midtown,Garment District,Central,8AM - 9PM,true,true,2024-10-08,Bradley Smith,bennettbrian@example.org,2022-05-24,American,Simmonsport,PW,false
35,782,9550,4.0,2023-08-20 00:10:51.000,delivery,"""I was thoroughly impressed with my delivery experience from Nolan Inc! The pasta dishes I ordered, specifically the Spaghetti Bolognese and Fettuccine Alfredo, were cooked to perfection and arrived hot and fresh at my doorstep. The flavors were rich and authentic, and the portion sizes were generous to say the least. My only minor quibble was that the garlic bread could have been crisper, but overall, I'd highly recommend Nolan Inc for a satisfying Italian food fix - 4/5 stars!""",Nolan Inc,Italian,$$$$,Midtown,Garment District,Central,9AM - 10PM,true,true,2024-06-20,Christopher Lawson,gonzalezlauren@example.com,2023-10-03,Thai,West Jacqueline,MD,false
36,405,7313,3.0,2024-06-25 00:10:51.000,dine-in,"**3.0/5 stars**

I stopped by Evans LLC for a mid-week dinner, hoping to indulge in some classic French cuisine. While the atmosphere was cozy and intimate, with dim lighting and soft jazz playing in the background, the food was somewhat of a mixed bag. The escargots were rich and flavorful, but the duck confit was overcooked and lacking in seasoning. Overall, it was a decent, if unremarkable, dining experience - not particularly memorable, but not disappointing either.",Evans LLC,French,$,Business District,Tech Corridor,Central,11AM - 9PM,true,true,2024-11-23,Valerie Coleman,agrant@example.org,2024-08-10,Mediterranean,Collinsstad,VI,false
37,609,2171,3.5,2023-03-28 00:10:51.000,delivery,"I recently ordered delivery from Jackson and Sons Wok, and while it was a solid, satisfying meal, it didn't particularly stand out from the pack. The Kung Pao chicken was cooked well, with a good balance of spicy and savory flavors, but the vegetables were a bit overcooked and the portion size was smaller than I expected. The egg rolls, on the other hand, were crispy and flavorful, and the fortune cookies were a nice touch. Overall, Jackson and Sons Wok is a reliable option for Chinese food, but it's not necessarily a destination worth going out of your way for.",Jackson and Sons Wok,Chinese,$$$,Business District,Tech Corridor,Central,8AM - 11PM,true,true,2024-04-04,Andrea Singleton,bairdcody@example.com,2024-09-17,Japanese,Dominguezshire,NY,true
38,835,7534,4.5,2024-12-25 00:10:51.000,delivery,"""I'm so glad I discovered Rodriguez Ltd, a hidden gem in the world of Vietnamese cuisine! I ordered delivery from them last night and was blown away by the flavors and freshness of the dishes. The pho was rich and aromatic, with tender beef and a generous serving of herbs, while the banh mi was crispy and perfectly balanced. My only minor quibble was that the spring rolls could have been crisper, but overall, I'm already planning my next order - 4.5 stars and highly recommended!""",Rodriguez Ltd,Vietnamese,$$$,West Side,Harborview,West,11AM - 11PM,true,true,2023-11-17,David Faulkner,newmanmichael@example.net,2022-05-25,Mediterranean,South Sabrina,SD,false
39,201,914,3.5,2024-08-07 00:10:51.000,delivery,"""I recently ordered delivery from Hernandez-Taylor Mediterranean to celebrate my sister's birthday, and I was thoroughly impressed with the flavors and quality of the dishes. The grilled lamb gyro was tender and juicy, and the spanakopita was crispy and well-seasoned. The portions were generous, and the prices were very reasonable. While the delivery took a bit longer than expected, the food was worth the wait - I'd definitely recommend Hernandez-Taylor for a satisfying and authentic Mediterranean meal. Overall, 3.5 stars - a great option for a special occasion or just a weeknight dinner.""",Hernandez-Taylor Mediterranean,Mediterranean,$,Downtown,Theater District,Central,7AM - 9PM,true,true,2023-06-02,Albert Hayes,darrellbaldwin@example.org,2024-01-13,Indian,East Richardmouth,MN,true
40,150,5792,2.0,2024-09-05 00:10:51.000,takeout,"**2/5 stars**

I was thoroughly underwhelmed by my takeout experience from Anderson, Manning and Fitzgerald. The Kung Pao chicken was a letdown, with overcooked chicken and a sauce that tasted more like ketchup than Szechuan pepper. The ""vegetable spring rolls"" were essentially just soggy, oil-drenched wonton wrappers filled with a few limp cabbage shreds. For the prices they're charging, I expect a lot more flavor and care in the preparation - unfortunately, this place fell far short.","Anderson, Manning and Fitzgerald",Chinese,$$$,East Side,Harbor Heights,East,11AM - 11PM,true,true,2023-11-14,Donald Black,craigsolomon@example.com,2024-10-04,Chinese,Williamsshire,WV,false
41,406,3250,1.5,2024-12-03 00:10:51.000,delivery,"I was thoroughly underwhelmed by my recent delivery experience from Carney-Crawford Spice. The chicken tikka masala, which I was really looking forward to, was a letdown - the chicken was dry and overcooked, and the sauce lacked the rich, creamy flavor I've come to expect from a good Indian restaurant. The basmati rice was also a bit mushy and overcooked, which didn't help matters. For the prices they're charging, I expected a lot more flavor and care in the preparation. Overall, a disappointing experience that I won't be repeating anytime soon.",Carney-Crawford Spice,Indian,$$$$,West Side,Harborview,West,9AM - 8PM,true,true,2024-02-15,Kim Rollins,waynefranklin@example.net,2023-07-13,Vietnamese,New Tanya,DC,false
42,435,4149,1.5,2024-09-13 00:10:51.000,dine-in,"I'm usually not one to write scathing reviews, but my recent experience at Hogan-Hill Diner was a major letdown. The service was slow and inattentive, with our server seemingly more interested in chatting with the kitchen staff than attending to our needs. The food was equally underwhelming - my burger patty was overcooked and dry, and the ""signature"" fries tasted like they'd been sitting out for hours. For a diner that's been around as long as Hogan-Hill has, I expected a lot more. Unfortunately, this place is in desperate need of a revamp.",Hogan-Hill Diner,American,$$$$,East Side,Eastwood,East,11AM - 9PM,true,true,2024-07-29,Mrs. Nicole Reid,keith45@example.org,2023-07-05,Indian,New Gary,AS,false
43,149,6703,4.0,2025-01-19 00:10:51.000,delivery,"""I recently ordered delivery from Wood-Bailey Mediterranean to celebrate my sister's birthday, and I'm so glad I did! The food arrived promptly and was still warm, which is no easy feat considering the 30-minute drive from the restaurant to my doorstep. The falafel platter was a highlight, with crispy, flavorful patties served atop a fresh mix of greens and veggies, and the creamy hummus was a perfect accompaniment. Overall, the quality and care that went into preparing our meal was evident, and I'd highly recommend Wood-Bailey for any occasion - 4/5 stars!""",Wood-Bailey Mediterranean,Mediterranean,$$$$,East Side,Harbor Heights,East,9AM - 9PM,true,true,2024-04-14,Frank Brown,nmendoza@example.com,2022-06-23,Japanese,Lake Ericabury,WY,false
44,588,8141,1.5,2024-11-28 00:10:51.000,takeout,"I'm still trying to process the disappointment that was my takeout experience from Smith, Smith and Munoz Cafe. The French cuisine, which I was expecting to be rich and sophisticated, fell flat with overcooked duck confit and a lackluster bouillabaisse that tasted more like a bland fish soup than the hearty, saffron-infused stew I've come to know and love. The ""freshly baked"" baguette was stale and the ""artisanal"" cheese plate was a sad assortment of pre-sliced, mass-produced cheeses. For the prices they're charging, I expect a lot more than this uninspired, subpar takeout.","Smith, Smith and Munoz Cafe",French,$$$,Downtown,Financial District,Central,8AM - 8PM,true,true,2024-10-30,Marc Perry,jacqueline13@example.org,2023-09-21,Indian,South Robertchester,OH,false
45,877,4447,1.0,2023-07-01 00:10:51.000,delivery,"I'm still trying to process the disappointment that was my delivery experience from Douglas-Williams. The Vietnamese cuisine I was expecting was nowhere to be found in the bland, uninspired dishes that arrived at my doorstep. The pho was lukewarm and lacking in depth of flavor, while the spring rolls were greasy and tasted more of stale oil than fresh herbs. For a restaurant that promises to bring the bold flavors of Vietnam to the table, Douglas-Williams fell woefully short - and at a premium price point, no less. Needless to say, I won't be ordering from here again.",Douglas-Williams,Vietnamese,$$$,West Side,Harborview,West,9AM - 9PM,true,true,2024-10-28,Andrew Fry,danielledaniels@example.net,2023-07-21,Chinese,New Charles,MA,true
46,446,8778,3.5,2023-11-20 00:10:51.000,takeout,"""I was pleasantly surprised by the flavors and freshness of the takeout from Hunter Group Vietnam. The pho was rich and aromatic, with tender beef and a generous serving of herbs and bean sprouts. The banh mi sandwich was also a highlight, with crispy baguette and pickled veggies adding a nice crunch. While the portions were a bit smaller than I expected, the quality of the ingredients and care in preparation made up for it - I'd definitely order from them again. Overall, a solid 3.5 stars for this hidden gem!""",Hunter Group Vietnam,Vietnamese,$$,East Side,Harbor Heights,East,7AM - 8PM,true,false,2025-01-19,Kayla Hicks,nunezthomas@example.net,2023-02-18,Thai,Lake Jasonchester,KY,true
47,314,4554,3.0,2024-12-08 00:10:51.000,takeout,"**3.0/5 stars**

I stopped by Stone, Bowers and Williams Pho for a quick takeout dinner and had a decent, if unremarkable, experience. The pho broth was rich and flavorful, but the beef slices were a bit overcooked and lacking in tenderness. The portion size was generous, but the noodles were slightly overcooked as well, making them a bit mushy. Overall, it was a solid, middle-of-the-road pho experience that didn't particularly impress or disappoint - a good option if you're in the area and craving Vietnamese, but not necessarily worth going out of your way for.","Stone, Bowers and Williams Pho",Vietnamese,$$$$,West Side,Riverside,West,10AM - 12PM,true,true,2023-07-07,Jonathan Moore,harveyjennifer@example.net,2023-12-13,Thai,Marshallton,NC,false
48,371,5300,4.0,2025-01-10 00:10:51.000,takeout,"""I was thoroughly impressed with my takeout experience from Robinson Ltd, a charming French bistro that truly delivers on its promise of haute cuisine. The duck confit I ordered was fall-off-the-bone tender, with a rich, velvety sauce that complemented the crispy skin perfectly. The accompanying garlic mashed potatoes and sautéed spinach were also expertly prepared, and the portion sizes were generous to say the least. While the packaging could have been more secure (my sauce did leak a bit during transport), the food itself was top-notch and I'd highly recommend Robinson Ltd to anyone craving authentic French flavors. 4/5 stars, and I look forward to dining in next time!""",Robinson Ltd,French,$$$,Uptown,Upper East Side,North,9AM - 12PM,true,true,2024-10-29,Angelica Pena,vhughes@example.net,2023-06-25,American,Lake Janet,MT,false
49,281,912,3.0,2024-06-20 00:10:51.000,dine-in,"**3.0/5 stars**

I stopped by Brady-Wells Tokyo for a mid-week dinner, hoping to satisfy my craving for authentic Japanese cuisine. While the restaurant's modern decor and attentive service were definite highlights, the food was somewhat of a mixed bag. The sushi was fresh and well-presented, but the flavors were surprisingly muted, and the tempura was overcooked and greasy. Overall, Brady-Wells Tokyo is a solid, if unremarkable, option for Japanese food in the area - worth a visit, but not necessarily a destination spot.",Brady-Wells Tokyo,Japanese,$$$$,East Side,Harbor Heights,East,7AM - 10PM,true,true,2025-01-13,Jennifer Mckenzie,asimpson@example.org,2024-02-01,Japanese,Tylershire,IA,false
50,695,6078,3.5,2025-01-29 00:10:51.000,delivery,"I recently tried Rios Group Pho's delivery service, and while it was a solid option for a quick Vietnamese fix, it didn't particularly stand out from the crowd. The pho broth was rich and flavorful, but the beef slices were slightly overcooked and lacking in tenderness. The spring rolls were crispy and fresh, but the accompanying peanut sauce was a bit too sweet for my taste. Overall, Rios Group Pho is a decent choice for delivery, but it's not a game-changer - 3.5 stars from me.",Rios Group Pho,Vietnamese,$$$$,University Area,College Town,North,8AM - 12PM,true,false,2025-02-05,Christopher Carter,williambarrett@example.net,2022-08-08,Indian,Scottmouth,RI,false
51,744,792,1.0,2024-06-22 00:10:51.000,dine-in,"I'm still trying to process the disappointment that was my dinner at Mclean and Sons. The service was abysmal, with our server seemingly more interested in chatting with the kitchen staff than attending to our needs. The food, unfortunately, was no better - the sushi was overpriced and lacked freshness, with the ""signature"" spicy tuna roll tasting more like a bland, mayonnaise-heavy mess. For a Japanese restaurant, the lack of attention to detail and care in preparation was staggering, and I would not recommend Mclean and Sons to anyone.",Mclean and Sons,Japanese,$$$,East Side,Harbor Heights,East,8AM - 11PM,true,true,2023-09-13,Joshua Coffey,aswanson@example.net,2022-04-20,Thai,North Maryland,SC,false
52,450,1305,4.0,2024-12-27 00:10:51.000,takeout,"""I was thoroughly impressed with my takeout experience from Taylor-Young, a hidden gem in the world of Chinese cuisine. The Kung Pao chicken was cooked to perfection, with a delightful balance of spicy and savory flavors, and the steamed dumplings were tender and juicy. The portions were generous, to say the least, and the prices were very reasonable. Overall, I'd highly recommend Taylor-Young for a quick and delicious Chinese food fix - just be prepared for a bit of a wait, as the takeout orders seemed to be backed up when I picked mine up. 4/5 stars, would definitely order again!""",Taylor-Young,Chinese,$$$,Uptown,Upper West Side,North,7AM - 12PM,true,true,2024-04-11,Cheryl Goodwin,conwaymichael@example.net,2024-02-23,Mediterranean,South Daniel,FM,true
53,664,8075,5.0,2023-09-20 00:10:51.000,takeout,"""I'm blown away by the incredible takeout experience I had from Chen, Morton and Bell - every dish I ordered was expertly prepared and bursting with flavor. The Kung Pao chicken was spicy and savory, with a perfect balance of crunchy peanuts and scallions, while the vegetable lo mein was cooked to a perfect tender-crisp texture. The real standout, however, was the Szechuan beef, which had a depth of flavor and numbing heat that left me craving more. Overall, I'm so impressed with the quality and care that clearly goes into every dish at Chen, Morton and Bell - I'll be ordering from them again and again!"" 5/5 stars","Chen, Morton and Bell",Chinese,$$$$,Uptown,Upper East Side,North,9AM - 10PM,true,true,2023-10-29,Keith Vasquez,moonelizabeth@example.com,2023-03-15,Thai,East Dannyville,OH,false
54,486,9241,2.5,2025-01-18 00:10:51.000,delivery,"**2.5/5 stars**

I was really looking forward to trying Taylor, Nunez and George Curry, but unfortunately, my delivery experience was a letdown. The chicken tikka masala, which I was most excited about, was overcooked and dry, with a sauce that tasted more like ketchup than rich, creamy tomato sauce. The basmati rice was also underseasoned and lacking in flavor. While the naan bread was a highlight, it wasn't enough to redeem the rest of the meal, which felt like a lazy, uninspired take on Indian cuisine.","Taylor, Nunez and George Curry",Indian,$,Downtown,Theater District,Central,7AM - 10PM,false,true,2023-07-01,Richard Sanchez,iherrera@example.org,2023-10-20,Thai,South Shawnport,FL,false
55,163,8096,2.5,2024-07-13 00:10:51.000,delivery,"**2.5/5 stars**

I was really looking forward to trying Morris, Mendoza and Peterson's Chinese delivery, especially since they claim to have a variety of vegetarian options. Unfortunately, my experience was a letdown. I ordered the Vegetable Lo Mein, which was supposed to be vegan and gluten-free, but it arrived with a suspiciously non-vegan sauce and a side of fortune cookies that contained gluten. The noodles themselves were overcooked and lacking in flavor, and the ""assorted vegetables"" were mostly just cabbage and carrots. For the price, I expected a lot more.","Morris, Mendoza and Peterson",Chinese,$$$$,West Side,Harborview,West,10AM - 10PM,false,true,2023-10-19,Amber Hill MD,dburns@example.com,2023-09-28,Chinese,East Kennethshire,CO,false
56,579,8306,4.5,2024-10-30 00:10:51.000,delivery,"""I'm so glad I discovered Johnson-Middleton Spice, which has quickly become my go-to for Indian food delivery. The Chicken Tikka Masala I ordered was rich and creamy, with tender chicken that practically fell apart, and the basmati rice was perfectly cooked. The naan bread was a highlight, with just the right amount of fluff and flavor. My only quibble was that the delivery took a bit longer than expected, but the food was worth the wait - I'd highly recommend Johnson-Middleton Spice to anyone craving authentic Indian cuisine. 4.5/5 stars!""",Johnson-Middleton Spice,Indian,$$$,Midtown,Garment District,Central,8AM - 9PM,true,true,2024-01-31,Aaron Shelton,coryholloway@example.net,2022-12-29,Chinese,Lake Christopherville,NY,false
57,134,2824,4.5,2024-02-11 00:10:51.000,takeout,"""I'm so glad I stumbled upon Richardson, Moore and Williams Curry - their takeout game is on point! I ordered the chicken tikka masala and saag paneer, and both dishes were rich, creamy, and full of depth. The flavors were expertly balanced, with just the right amount of heat and spice. My only quibble is that the basmati rice was a tad overcooked, but that's a minor complaint in an otherwise outstanding meal. Overall, I'd highly recommend RMW Curry for a delicious and satisfying Indian food fix - 4.5 stars, no question!""","Richardson, Moore and Williams Curry",Indian,$,West Side,Riverside,West,8AM - 12PM,true,false,2023-04-11,Brian Turner,howekaren@example.org,2022-10-23,Various,West Kelseymouth,OR,true
58,979,1169,2.5,2024-12-22 00:10:51.000,takeout,"**2.5/5 stars**

I was really looking forward to trying Turner, Barnes and Duncan's takeout, but unfortunately, my experience was a letdown. The Kung Pao chicken was overcooked and dry, with a sauce that tasted more like ketchup than the spicy, savory flavor I've come to expect from this dish. The vegetable lo mein was similarly uninspired, with a lackluster mix of frozen veggies and a bland seasoning. For the prices they're charging, I expected a lot more flavor and care in the preparation - sadly, Turner, Barnes and Duncan fell short.","Turner, Barnes and Duncan",Chinese,$$$,Suburb,Oakwood,Outer,7AM - 12PM,false,true,2023-05-02,Ronnie Collier,cdean@example.net,2024-08-11,American,Blanchardview,NJ,false
59,34,2792,4.0,2023-06-13 00:10:51.000,delivery,"""I'm so glad I discovered Maldonado Inc Pho, a hidden gem that delivers (literally!) delicious and authentic Vietnamese cuisine right to my doorstep. As a vegetarian, I was thrilled to see a variety of options on the menu, and the Vegetable Pho I ordered did not disappoint - the broth was rich and flavorful, and the portion was generous. The only reason I'm not giving it a full 5 stars is that the noodles were slightly overcooked, but overall, I'm excited to try more of their offerings and would highly recommend Maldonado Inc Pho to anyone craving a satisfying and comforting bowl of pho.""",Maldonado Inc Pho,Vietnamese,$$,Uptown,Upper East Side,North,9AM - 12PM,true,true,2024-10-13,Donald Villarreal,sotosummer@example.org,2022-11-11,Japanese,Thomasstad,ME,false
60,547,4446,5.0,2024-10-08 00:10:51.000,takeout,"""I'm still reeling from the incredible takeout experience I had with Swanson Ltd - this hidden gem truly deserves its spot at the top of the Thai food hierarchy. The Green Curry with chicken was a masterclass in balance and flavor, with tender, juicy meat and a rich, creamy sauce that had me scraping the bottom of the container. The portion was generous, to say the least, and the prices were more than reasonable for the quality and quantity provided. If you're a Thai food lover like myself, do yourself a favor and order from Swanson Ltd ASAP - you won't regret it!"" 5/5 stars",Swanson Ltd,Thai,$,Midtown,Chelsea,Central,8AM - 9PM,true,true,2024-02-23,Richard Webb,kenneth86@example.net,2024-06-21,Indian,North Bernardtown,GU,false
61,644,341,3.5,2024-12-25 00:10:51.000,takeout,"I stopped by Long-Lowery Spice for a takeout order and had a decent, if unremarkable, experience. The chicken tikka masala was rich and creamy, but lacked a bit of depth in terms of spice and flavor. The basmati rice and naan bread were cooked well, but nothing about the meal really stood out as exceptional. Overall, Long-Lowery Spice is a solid choice for a quick and satisfying Indian food fix, but it didn't blow me away. For the price, I'd say it's a fair value, but not necessarily a destination worth going out of your way for.",Long-Lowery Spice,Indian,$$$,University Area,College Town,North,9AM - 12PM,true,true,2023-09-29,Chad Acosta,ogarner@example.org,2023-04-19,Chinese,Danieltown,MP,false
62,669,8389,3.5,2023-05-31 00:10:51.000,dine-in,"**3.5/5 stars**

I stopped by Gray, Obrien and Davis with a group of friends to celebrate a birthday, and while the experience was pleasant, it didn't quite blow us away. The Vietnamese cuisine was flavorful and authentic, with the pho and banh mi sandwiches being standouts, but the service was a bit spotty - our server seemed overwhelmed and took a while to take our orders. The atmosphere was modern and sleek, but lacked a bit of warmth and character. Overall, it was a solid choice for a casual dinner, but not necessarily a go-to for a special occasion.","Gray, Obrien and Davis",Vietnamese,$$$$,Suburb,Pine Hills,Outer,7AM - 11PM,true,true,2024-10-25,Trevor Thompson,steventran@example.net,2024-11-09,Chinese,Lake Harry,ME,true
63,274,1020,3.5,2024-10-10 00:10:51.000,takeout,"""I was pleasantly surprised by the flavors and value of my takeout order from Schmidt, Deleon and Dyer Curry. The Chicken Tikka Masala was rich and creamy, with tender chicken that was clearly marinated to perfection. The basmati rice and naan bread were also well-cooked and generously portioned. While the service was a bit slow (it took about 20 minutes longer than expected to receive my order), the quality of the food made up for the wait - I'd definitely order from here again, especially at these prices. Overall, a solid 3.5 stars for this hidden gem!""","Schmidt, Deleon and Dyer Curry",Indian,$$$$,East Side,Eastwood,East,10AM - 8PM,false,true,2023-11-07,Brandon Graham,brenda09@example.com,2023-09-26,Vietnamese,Hayesview,MP,false
